{
  "schema_version": "1.0.0",
  "report_version": "runtime-capability-2026-07-26.1",
  "created_at": "2026-07-29T04:12:02.495528+00:00",
  "profile": "agent_full_power_gpu",
  "status": "BLOCKED_RUNTIME_UNAVAILABLE",
  "status_reason": "The target local runtime is not installed or its accelerator capability is not verified.",
  "hardware": {
    "platform": "macOS-26.5.2-arm64-arm-64bit",
    "python": "3.12.13 (main, Apr 14 2026, 14:33:40) [Clang 22.1.3 ]",
    "machine": "arm64",
    "preflight_snapshot": {
      "platform": "macOS-26.5.2-arm64-arm-64bit",
      "python": "3.12.13 (main, Apr 14 2026, 14:33:40) [Clang 22.1.3 ]",
      "machine": "arm64",
      "processor": "arm",
      "memory": {
        "memsize_bytes": "17179869184",
        "cpu_count": "10",
        "arm64": "1",
        "swap": {
          "command": [
            "/usr/sbin/sysctl",
            "vm.swapusage"
          ],
          "returncode": 0,
          "stdout": "vm.swapusage: total = 6144.00M  used = 4569.31M  free = 1574.69M  (encrypted)",
          "stderr": ""
        },
        "vm_stat": {
          "command": [
            "/usr/bin/vm_stat"
          ],
          "returncode": 0,
          "stdout": "Mach Virtual Memory Statistics: (page size of 16384 bytes)\nPages free:                                    14549.\nPages active:                                 216209.\nPages inactive:                               483956.\nPages speculative:                              8115.\nPages throttled:                                   0.\nPages wired down:                             139860.\nPages purgeable:                                   3.\n\"Translation faults\":                      527706083.\nPages copy-on-write:                        24532054.\nPages zero filled:                         250547064.\nPages reactivated:                         144227605.\nPages purged:                                3425736.\nFile-backed pages:                            559478.\nAnonymous pages:                              148802.\nPages stored in compressor:                   775971.\nPages occupied by compressor:                 143255.\nDecompressions:                            165354417.\nCompressions:                              233663742.\nPageins:                                  1745011491.\nPageouts:                                     107178.\nSwapins:                                    27576192.\nSwapouts:                                   37367305.\nPages tagged:                                  76346.\nPages tagged resident:                         59213.\nPages tagged compressed:                       17133.\nPages tag-storage:                             32768.\nPages tag-storage holding tags:                 4297.\nPages tag-storage free:                          184.\nPages tag-storage non-tag pageable:            28208.\nPages tag-storage non-tag wired:                  79.\nBytes of compressed tags:                    2639744.\nTagged compressions:                         2368360.\nTagged decompressions:                       2177551.",
          "stderr": ""
        }
      },
      "sw_vers": {
        "command": [
          "sw_vers"
        ],
        "returncode": 0,
        "stdout": "ProductName:\t\tmacOS\nProductVersion:\t\t26.5.2\nBuildVersion:\t\t25F84",
        "stderr": ""
      },
      "disk": {
        "command": [
          "df",
          "-h",
          "<project-root>"
        ],
        "returncode": 0,
        "stdout": "Filesystem      Size    Used   Avail Capacity iused ifree %iused  Mounted on\n/dev/disk3s5   460Gi   191Gi   241Gi    45%    1.7M  2.5G    0%   /System/Volumes/Data",
        "stderr": ""
      }
    }
  },
  "preflight": {
    "status": "BLOCKED",
    "recommended_exit_code": 20,
    "gate_statuses": {
      "hardware_detection": "PASS",
      "local_runtime_capability": "BLOCKED",
      "immutable_style_lora": "PASS",
      "approved_source_background": "PASS",
      "source_fixture_and_provenance": "PASS",
      "planning_package_checksums": "PASS",
      "model_artifact_preflight": "PASS",
      "custom_node_preflight": "PASS",
      "comfyui_runtime_dependency_lock": "PASS",
      "remote_topology_auth": "NOT_APPLICABLE",
      "repository_preflight": "PASS",
      "calibrated_identity_thresholds": "BLOCKED",
      "krea_live_compatibility": "PASS",
      "autoprompter_runtime": "NOT_APPLICABLE",
      "preprocessing_and_audit_dependencies": "PASS",
      "license_and_rights_review": "APPROVED"
    },
    "blockers": [
      "The required CUDA runtime, Python floor, PyTorch capability, or ComfyUI installation is not verified; this profile cannot be claimed executable.",
      "Calibration evidence exists but does not yet demonstrate the required approved identity/style threshold set; no production candidate may be accepted.",
      "Krea 2 source-specific production acceptance and the immutable style-LoRA experiment matrix remain blocked: the default MPS route fails, the CPU fallback has one completed heavily-swapping run plus a newer interrupted canary, and calibrated audit thresholds plus independent audit evidence are still required."
    ]
  },
  "resource_model": {
    "expected_model_bytes": 20694849246,
    "physical_memory_bytes": 17179869184,
    "expected_model_to_physical_memory_ratio": 1.2045987675664946,
    "capacity_assessment": "MODEL_BYTES_EXCEED_PHYSICAL_MEMORY_RISK_ONLY",
    "peak_memory_bytes": null,
    "peak_vram_bytes": null,
    "measurement_note": "File-size arithmetic is not a measured execution or OOM result; offload, allocator overhead, activations, and runtime staging remain unmeasured.",
    "locked_artifacts": [
      {
        "name": "krea2_turbo_fp8_scaled.safetensors",
        "filename": "krea2_turbo_fp8_scaled.safetensors",
        "size_bytes": 13141730784,
        "revision": "952f49d49653cb42e7d6cf7cbfad74738073ec7d",
        "sha256": "eb4dd8c612cfd10f64f25b057e6e6bbcb5737c94a7372177e456dbf7579502f1",
        "shard_sha256": null,
        "source_url": "https://huggingface.co/Comfy-Org/Krea-2/resolve/952f49d49653cb42e7d6cf7cbfad74738073ec7d/diffusion_models/krea2_turbo_fp8_scaled.safetensors"
      },
      {
        "name": "qwen3vl_4b_fp8_scaled.safetensors",
        "filename": "qwen3vl_4b_fp8_scaled.safetensors",
        "size_bytes": 5242467968,
        "revision": "952f49d49653cb42e7d6cf7cbfad74738073ec7d",
        "sha256": "54bd5144df0bbc25dd6ccadfcb826b521445a1b06ae5a42570bdd2974ca87094",
        "shard_sha256": null,
        "source_url": "https://huggingface.co/Comfy-Org/Krea-2/resolve/952f49d49653cb42e7d6cf7cbfad74738073ec7d/text_encoders/qwen3vl_4b_fp8_scaled.safetensors"
      },
      {
        "name": "qwen_image_vae.safetensors",
        "filename": "qwen_image_vae.safetensors",
        "size_bytes": 253806246,
        "revision": "952f49d49653cb42e7d6cf7cbfad74738073ec7d",
        "sha256": "a70580f0213e67967ee9c95f05bb400e8fb08307e017a924bf3441223e023d1f",
        "shard_sha256": null,
        "source_url": "https://huggingface.co/Comfy-Org/Krea-2/resolve/952f49d49653cb42e7d6cf7cbfad74738073ec7d/vae/qwen_image_vae.safetensors"
      },
      {
        "name": "krea2_identity_edit_v1_2.safetensors",
        "filename": "krea2_identity_edit_v1_2.safetensors",
        "size_bytes": 1828256432,
        "revision": "2686ea3601417448f9649f6e74ca7103d446da96",
        "sha256": "6adf9a69cc9502d286db7b69964d37da7e9cfe4b05b4d004bc275f087d3fd3cf",
        "shard_sha256": null,
        "source_url": "https://huggingface.co/conradlocke/krea2-identity-edit/resolve/2686ea3601417448f9649f6e74ca7103d446da96/krea2_identity_edit_v1_2.safetensors"
      },
      {
        "name": "immutable_style_lora",
        "filename": "loras/hoi4_portrait_new_style_lora.safetensors",
        "size_bytes": 228587816,
        "revision": "project-owned-immutable",
        "sha256": "2ad94552d151d2dedf151cf7356cdd3ea07677607ff289fc0ac61534b34dead1",
        "actual_sha256": "2ad94552d151d2dedf151cf7356cdd3ea07677607ff289fc0ac61534b34dead1",
        "source_url": null
      }
    ]
  },
  "measurements": {
    "workflow_structure": {
      "status": "PASS",
      "workflow_id": "agent_full_power_gpu",
      "structural_status": "PASS",
      "runtime_status": "NOT_MEASURED",
      "issues": []
    },
    "runtime_health": {
      "status": "PASS_SCHEMA_ONLY",
      "binding": "http://127.0.0.1:8188",
      "raw_comfy_binding": "loopback_only",
      "reason": "Live health and /object_info schema evidence exists; no source-specific generation claim is made.",
      "evidence_path": "docs/preflight/live_comfy_compatibility.json",
      "target_profile_accelerator": "CUDA",
      "target_profile_accelerator_status": "BLOCKED"
    },
    "workflow_load": {
      "status": "PASS_SCHEMA_ONLY",
      "workflow_id": "agent_full_power_gpu",
      "reason": "Live node-registry/load-shape validation passed; this is not a model-loading or eight-step execution result.",
      "evidence_path": "docs/preflight/live_comfy_compatibility.json"
    },
    "dry_validation_job": {
      "status": "PASS_PREPROCESSING_ONLY_PRODUCTION_GATES_BLOCKED",
      "reason": "The source fixture, approved background, and deterministic preprocessing route are evidenced; calibrated identity/style thresholds and independent audit still block promotion."
    },
    "generation": {
      "status": "BLOCKED_NOT_ATTEMPTED",
      "candidate_count": 0,
      "reason": "Portrait generation was not attempted while source, background, threshold, and audit gates remained blocked."
    },
    "thermal": {
      "status": "NOT_MEASURED",
      "samples": [],
      "swap_observed": false,
      "reason": "Thermal samples were not captured for this run; CPU fallback evidence records swap behavior separately."
    },
    "quality": {
      "status": "NOT_MEASURED",
      "candidate_count": 0,
      "identity_pass_rate": null,
      "style_pass_rate_among_identity_pass": null
    },